index	text	entity_category	image_id	person	location	organization	miscellaneous	image_caption	no_image	image_caption_ofa_large
165	Predicting Every NFL Team ' s Most Heated Camp Battle . . .	[('NFL', 'organization')]	16_05_31_1048.jpg	[]	[]	['NFL']	[]		No	a group of football players walking down the field
3307	Golden State Warriors Look to Break 20 - Year NBA Record . . .	[('Golden State Warriors', 'organization'), ('NBA', 'organization')]	16_05_05_952.jpg	[]	[]	['Golden State Warriors', 'NBA']	[]		No	a man holding a cell phone in front of a basketball player
1744	Louis Vuitton x Supreme skate set that will be $ 54,500 retail 😳	[('Louis Vuitton', 'organization'), ('Supreme', 'organization')]	O_2467.jpg	[]	[]	['Louis Vuitton', 'Supreme']	[]		No	a red suitcase with a red and white pattern on it
2126	BonnyCombs25 : Watch Jimmy Kimmel Grill Kelly Ripa on First Michael Strahan - Less Live -	[('Jimmy Kimmel', 'person'), ('Kelly Ripa', 'person'), ('Michael Strahan', 'person')]	O_4605.jpg	['Jimmy Kimmel', 'Kelly Ripa', 'Michael Strahan']	[]	[]	[]		Yes	the windshield of a car parked in a parking lot
1636	Army star Kelsey Minato gets a chance to play in WNBA	[('Army', 'organization'), ('Kelsey Minato', 'person'), ('WNBA', 'organization')]	16_05_07_504.jpg	['Kelsey Minato']	[]	['Army', 'WNBA']	[]		No	a group of women playing a game of basketball
1703	Jim Morrison did not die for this shit	[('Jim Morrison', 'person')]	O_165.jpg	['Jim Morrison']	[]	[]	[]		No	a screenshot of a t shirt on a website with a picture on it
3214	Year 8 Premier League Reading Stars enjoying their trip to Stamford Bridge yesterday .	[('Premier League', 'organization'), ('Stamford Bridge', 'location')]	16_05_05_941.jpg	[]	['Stamford Bridge']	['Premier League']	[]		No	the team poses for a picture in the stadium
3257	You ' ve still got time to get your lineup ready for this week ' s # Bundesliga soccer contests .	[('Bundesliga', 'organization')]	16_05_14_457.jpg	[]	[]	['Bundesliga']	[]		No	football player gestures to his assistant during a match against football team
1036	Rihanna and her butt perform at her ANTI concert ( photos )	[('Rihanna', 'person')]	16_05_06_960.jpg	['Rihanna']	[]	[]	[]		No	a woman wearing a white costume with a cigarette
4	Eric Nam announces concert dates for Atlanta and NYC !	[('Eric Nam', 'person'), ('Atlanta', 'location'), ('NYC', 'location')]	17_06_12486.jpg	['Eric Nam']	['Atlanta', 'NYC']	[]	[]		No	person covers the issue of magazine in a black hoodie and shirt
473	The different types of people in the One Direction fandom # NoControlDay	[('One Direction', 'person')]	O_1460.jpg	['One Direction']	[]	[]	[]		No	a black and white photo of a person with their hands up
1735	# MLB Groundbreaking livestream debuts today	[('MLB', 'organization')]	17_06_10800.jpg	[]	[]	['MLB']	[]		No	a woman sitting on a chair in front of a television
2817	It ' s great to be heading back to @ Y_Not_Festival this year . One of our favourite moments of last summer !	[('Y_Not_Festival', 'miscellaneous')]	16_05_01_354.jpg	[]	[]	[]	['Y_Not_Festival']		No	a flyer for a concert with a list of dates and prices
1323	Premier League should consider return to safe standing : COMMENTARY BY IAN HERBERT : I . .	[('Premier League', 'organization'), ('IAN HERBERT', 'person')]	17_06_7631.jpg	['IAN HERBERT']	[]	['Premier League']	[]		No	a crowd of fans in the stands watching a soccer game
1771	Scott Murray bringing the lols with his choice of Premier League best player	[('Scott Murray', 'person'), ('Premier League', 'organization')]	16_05_16_396.jpg	['Scott Murray']	[]	['Premier League']	[]		No	a screenshot of a text message with a quote from the vaticanaticanatican website
585	FREE Weekend In The Woods Festival – Saturday , June 18 th # HoCoEvents @ ColumbiaFestArt	[('In The Woods Festival', 'miscellaneous'), ('ColumbiaFestArt', 'miscellaneous')]	16_05_27_124.jpg	[]	[]	[]	['In The Woods Festival', 'ColumbiaFestArt']		No	a piece of art with different colors on it
3051	BREAKING : DONALD TRUMP HAS OFFICIALLY SURPASSED 1237 DELEGATES ! !	[('DONALD TRUMP', 'person')]	O_2039.jpg	['DONALD TRUMP']	[]	[]	[]		No	a screenshot of a cell phone
2055	MLB : White Sox 5, Blue Jays 2 . HIGHLIGHTS :	[('MLB', 'organization'), ('White Sox', 'organization'), ('Blue Jays', 'organization')]	17_06_5520.jpg	[]	[]	['MLB', 'White Sox', 'Blue Jays']	[]		No	a screenshot of a game of baseball with different players and numbers
1515	Candid , blurry photo of me at a Rush concert 😂 😄	[('Rush', 'person')]	16_05_01_29.jpg	['Rush']	[]	[]	[]		No	a woman with long hair standing in the dark
1663	If you see Justin Bieber in public , please don ' t ask him to take a photo with you :	[('Justin Bieber', 'person')]	O_4770.jpg	['Justin Bieber']	[]	[]	[]		No	a young man wearing a plaid shirt and a bandana
2508	Harry Styles and his Mercedes Benz convertible 1966 is visual therapy	[('Harry Styles', 'person'), ('Mercedes Benz', 'organization')]	O_4195.jpg	['Harry Styles']	[]	['Mercedes Benz']	[]		No	a woman standing next to a white car
1510	"Demi Lovato on Taylor Swift : "" Don ' t brand yourself a feminist if you don ' t do the work """	[('Demi Lovato', 'person'), ('Taylor Swift', 'person')]	O_1305.jpg	['Demi Lovato', 'Taylor Swift']	[]	[]	[]		No	two pictures of a woman with black and white hair and makeup
3041	Jim Tomsula : # JarrydHayne ' represented himself well ' in first NFL start # JarrydHayne	[('Jim Tomsula', 'person'), ('JarrydHayne', 'person'), ('NFL', 'organization'), ('JarrydHayne', 'person')]	17_06_15117.jpg	['Jim Tomsula', 'JarrydHayne', 'JarrydHayne']	[]	['NFL']	[]		No	a football player running with the ball
698	Jose Mourinho ' s Real Madrid reunion a compelling introduction to 2017 - 18 # RealMadrid # laliga	[('Jose Mourinho', 'person'), ('Real Madrid', 'organization'), ('RealMadrid', 'organization'), ('laliga', 'organization')]	17_06_11892.jpg	['Jose Mourinho']	[]	['Real Madrid', 'RealMadrid', 'laliga']	[]		No	football player reacts during the match against football team
280	Ranking the NFL ' s best of past 30 years : Teams , offenses , more	[('NFL', 'organization')]	17_06_9124.jpg	[]	[]	['NFL']	[]		No	two football players and a man with their hands in the air
3090	Lol my lil bro and cousin definitely wilding at Nimitz 😂 😂 😂 😂	[]	O_662.jpg	[]	[]	[]	[]		No	a man and a woman standing in front of a yellow wall
2279	Another Big and exciting day for us ! Kieren is on parade today at the commissioning ceremony where he ' ll be commiss …	[('Kieren', 'person')]	16_05_20_759.jpg	['Kieren']	[]	[]	[]		No	a group of men in red uniforms standing in front of a building
1917	Hires at 11 AM tomorrow . Keep ponchos and small umbrellas handy . Will end by parade time	[]	17_01_2806.jpg	[]	[]	[]	[]		No	a map of precipitation anomalies in the eastern united states
3301	pictured : harry potter during most of the events of Harry Potter ( 1997 - 2007 )	[('harry potter', 'person'), ('Harry Potter', 'miscellaneous')]	O_2316.jpg	['harry potter']	[]	[]	['Harry Potter']		No	a black bird walking through the tall grass
946	16,000 people just watched me get a live tattoo of Donald Trump sucking a dick . Welcome to the future .	[('Donald Trump', 'person')]	O_316.jpg	['Donald Trump']	[]	[]	[]		No	a tattoo of a man with a cigarette in his mouth
1979	Thanks for making this LittleMixers first concert an awesomely freaky one ! @ LittleMix # GetWeirdTourSydney	[('LittleMixers', 'person'), ('LittleMix', 'person')]	16_05_13_76.jpg	['LittleMixers', 'LittleMix']	[]	[]	[]		No	a woman holding a get weird sign at an airport
3067	Are you guys ready for # concertsonthecreek ? 2 weeks away from summer music in Jackson County .	[('Jackson County', 'location')]	16_05_13_565.jpg	[]	['Jackson County']	[]	[]		No	every friday memorial day through theccc concerts on the creek poster
3053	Seriously relating to my 13 year old self and Bruno Mars rn x inspirational x	[('Bruno Mars', 'person')]	O_2570.jpg	['Bruno Mars']	[]	[]	[]		No	a screenshot of a tweet that says chloe creeps may 9 2011 at 00
654	NBA playoff scores 2016 : Paul George and the Pacers are making the Raptors # NBA # NBA	[('NBA', 'organization'), ('Paul George', 'person'), ('Pacers', 'organization'), ('Raptors', 'organization'), ('NBA', 'organization'), ('NBA', 'organization')]	17_06_6636.jpg	['Paul George']	[]	['NBA', 'Pacers', 'Raptors', 'NBA', 'NBA']	[]		No	olympic athlete passes the ball as basketball player defends during a game
630	Cowboys quarterback Tony Romo opens up about family , faith and football :	[('Cowboys', 'organization'), ('Tony Romo', 'person')]	16_05_25_21.jpg	['Tony Romo']	[]	['Cowboys']	[]		No	a family posing for a picture with a football
2337	2011 when SNSD came out on the screens in Times Square in NY ♥ ♥	[('SNSD', 'person'), ('Times Square', 'location'), ('NY', 'location')]	O_4417.jpg	['SNSD']	['Times Square', 'NY']	[]	[]		No	a billboard for nsync on the side of a building in the city
3093	. @ ErvinSantana_54 takes the mound in the series opener vs Oakland . # SMELLBASEBALL # MNTwins	[('ErvinSantana_54', 'person'), ('Oakland', 'organization'), ('MNTwins', 'organization')]	16_05_30_261.jpg	['ErvinSantana_54']	[]	['Oakland', 'MNTwins']	[]		No	a baseball player kissing his face next to a lineup of numbers
3363	Soccer central at sugar hollow park . # #	[]	16_05_30_57.jpg	[]	[]	[]	[]		No	a view of a baseball field from a train
1623	Cold morning but no better way to warm up then some great soccer ! Let ' s Go VSA ! # WeAreVSA	[('VSA', 'organization')]	16_05_15_775.jpg	[]	[]	['VSA']	[]		No	the girls soccer team huddled together on the field
2473	# MLB Breaking : San Diego Gay Men ' s Chorus heckled off stage , not allowed to . . .	"[('MLB', 'organization'), ('San Diego', 'location'), (""Gay Men ' s Chorus"", 'person')]"	16_05_26_919.jpg	"[""Gay Men ' s Chorus""]"	['San Diego']	['MLB']	[]		No	a group of men in black uniforms singing in front of a microphone
528	In the 9 th round of the # MLBDraft , the # MNTwins select Mark Contreras from @ UCR_Baseball .	[('MNTwins', 'organization'), ('Mark Contreras', 'person'), ('UCR_Baseball', 'organization')]	17_06_11420.jpg	['Mark Contreras']	[]	['MNTwins', 'UCR_Baseball']	[]		No	a poster of a baseball player catching a ball
3063	BREAKING NEWS : Kevin Durant has signed with the Pittsburgh Penguins !	[('Kevin Durant', 'person'), ('Pittsburgh Penguins', 'organization')]	O_547.jpg	['Kevin Durant']	[]	['Pittsburgh Penguins']	[]		No	a man wearing a shirt with his arms crossed
797	Donald Trump ’ s ascent watched with wariness in Asia	[('Donald Trump', 'person'), ('Asia', 'location')]	O_2793.jpg	['Donald Trump']	['Asia']	[]	[]		No	the font geeks go to resource for free fonts to use on your website
1616	Why narcissistic behaviour is a plus for politicians — including Justin Trudeau	[('Justin Trudeau', 'person')]	O_4122.jpg	['Justin Trudeau']	[]	[]	[]		No	a man with his hand on his chin
1425	The man himself Michael Ozuna happy birthday brother baseball is my life too . You my day 1 from Puerto rico 😍 💯 ❤ ️	[('Michael Ozuna', 'person'), ('Puerto rico', 'location')]	16_05_15_772.jpg	['Michael Ozuna']	['Puerto rico']	[]	[]		No	a young boy standing next to a chair
1342	There is nothing like singing along to the One Tree Hill theme song .	[('One Tree Hill', 'miscellaneous')]	O_1801.jpg	[]	[]	[]	['One Tree Hill']		No	a collage of people singing and dancing at a party
1278	LADY GAGA IS CONSISTENTLY THE HOTTEST GIRL IN THE ROOM # metgala	[('LADY GAGA', 'person'), ('metgala', 'miscellaneous')]	O_1448.jpg	['LADY GAGA']	[]	[]	['metgala']		No	a woman standing on the red carpet with her legs crossed
2332	NFL Ravens reportedly studying the possible violation of the CBA at minicamp	[('NFL', 'organization'), ('Ravens', 'organization'), ('CBA', 'organization')]	16_05_16_492.jpg	[]	[]	['NFL', 'Ravens', 'CBA']	[]		No	football players and coaches watch as american football player walks off the field with football
188	Good luck to my FAU Baseball boys as they head down to Miami Friday for Regionals ! # TheU # Throwback # BeatLongBeachS …	[('FAU', 'organization'), ('Miami', 'location')]	16_05_30_194.jpg	[]	['Miami']	['FAU']	[]		No	a baseball player holding a bat at a game
1447	👑 Katy Perry and Lady Gaga appreciation tweet 👑	[('Katy Perry', 'person'), ('Lady Gaga', 'person')]	O_623.jpg	['Katy Perry', 'Lady Gaga']	[]	[]	[]		No	two pictures of a woman wearing sunglasses and
